{
  "version": 1,
  "evidencePolicy": "fail-closed-real-built-artifact-only",
  "requiredFeatureIds": [
    "language-modes",
    "dialog-emoji-toggle",
    "school-mode",
    "narration",
    "scheduled-settings",
    "dim-sum-surprise",
    "regex-builders",
    "notification-centre",
    "appearance-editors",
    "tabbed-navigation",
    "offline-documentation",
    "command-palette",
    "destructive-confirmation",
    "local-history",
    "changelog-viewer",
    "external-editor",
    "exports",
    "bulk-actions",
    "accessibility-responsive-sizing",
    "personal-vocabulary-upload",
    "toy-locks-authentication",
    "unlock-ladder",
    "shared-link-embed",
    "adhd-modes",
    "browser-download-surfaces",
    "app-logo-customization",
    "file-converter",
    "ollama-suite-manager",
    "status-hub",
    "front-screen-provenance"
  ],
  "requiredDestinationIds": [
    "home-default-light",
    "projects-default-light",
    "design-systems-default-light",
    "automations-default-light",
    "plugins-default-light",
    "integrations-default-light",
    "studio-default-light",
    "library-default-light",
    "settings-appearance-light",
    "handoff-default-light"
  ],
  "surfaces": [
    {
      "id": "windows-desktop-application",
      "kind": "desktop-application",
      "status": "unreachable",
      "statusReason": "No launchable current-commit packaged artifact is present. Runtime interaction and capture remain unverified.",
      "destinations": [
        {
          "id": "home-default-light",
          "status": "unreachable",
          "statusReason": "Application route and built-artifact evidence are pending.",
          "requiredInteractionIds": [
            "open-home"
          ]
        },
        {
          "id": "projects-default-light",
          "status": "unreachable",
          "statusReason": "Application route and built-artifact evidence are pending.",
          "requiredInteractionIds": [
            "open-projects"
          ]
        },
        {
          "id": "design-systems-default-light",
          "status": "unreachable",
          "statusReason": "Application route and built-artifact evidence are pending.",
          "requiredInteractionIds": [
            "open-design-systems"
          ]
        },
        {
          "id": "automations-default-light",
          "status": "unreachable",
          "statusReason": "Application route and built-artifact evidence are pending.",
          "requiredInteractionIds": [
            "open-automations"
          ]
        },
        {
          "id": "plugins-default-light",
          "status": "unreachable",
          "statusReason": "Application route and built-artifact evidence are pending.",
          "requiredInteractionIds": [
            "open-plugins"
          ]
        },
        {
          "id": "integrations-default-light",
          "status": "unreachable",
          "statusReason": "Application route and built-artifact evidence are pending.",
          "requiredInteractionIds": [
            "open-integrations"
          ]
        },
        {
          "id": "studio-default-light",
          "status": "unreachable",
          "statusReason": "The canonical route remains unresolved.",
          "requiredInteractionIds": [
            "open-studio"
          ]
        },
        {
          "id": "library-default-light",
          "status": "unreachable",
          "statusReason": "The canonical route remains hidden or unresolved.",
          "requiredInteractionIds": [
            "open-library"
          ]
        },
        {
          "id": "settings-appearance-light",
          "status": "unreachable",
          "statusReason": "The canonical appearance route remains unresolved.",
          "requiredInteractionIds": [
            "open-settings-appearance"
          ]
        },
        {
          "id": "handoff-default-light",
          "status": "unreachable",
          "statusReason": "The canonical handoff route remains unresolved.",
          "requiredInteractionIds": [
            "open-handoff"
          ]
        }
      ],
      "features": [
        { "id": "language-modes", "status": "partial", "statusReason": "The mounted universal settings panel and runtime expose all three modes and independent funny levels. Packaged interaction and per-click proof remain absent.", "implementationPath": "design/apps/web/src/components/universal-settings/UniversalSettingsPanel.tsx", "documentationPath": "docs/standards/language-modes.md", "requiredInteractions": [{ "id": "change-language-mode", "action": "select", "target": "language mode control", "expectedBefore": "current language is visible", "expectedAfter": "selected language is applied across the surface", "postClickCaptureRequired": true }], "evidenceReceipts": [] },
        { "id": "dialog-emoji-toggle", "status": "partial", "statusReason": "The mounted universal runtime applies the persisted dialog-decoration preference without changing factual copy. Packaged interaction remains absent.", "implementationPath": "design/apps/web/src/components/universal-settings/UniversalSettingsRuntime.tsx", "documentationPath": "docs/standards/universal-settings.md", "requiredInteractions": [{ "id": "toggle-dialog-emojis", "action": "click", "target": "dialog emoji toggle", "expectedBefore": "toggle state is visible", "expectedAfter": "dialog decoration changes without changing factual copy", "postClickCaptureRequired": true }], "evidenceReceipts": [] },
        { "id": "school-mode", "status": "partial", "statusReason": "The mounted universal settings owner exposes rename, credential setup, live state, and suppression seams. Complete host-vault and every-consumer proof remain absent.", "implementationPath": "design/apps/web/src/components/universal-settings/UniversalSettingsPanel.tsx", "documentationPath": "docs/standards/universal-settings.md", "requiredInteractions": [{ "id": "enable-school-mode", "action": "click", "target": "school mode toggle", "expectedBefore": "mode is off", "expectedAfter": "mode is on and suppressed features are absent", "postClickCaptureRequired": true }], "evidenceReceipts": [] },
        { "id": "narration", "status": "partial", "statusReason": "The mounted universal panel and runtime expose opt-in narration, language order, stable voice choices, fallback status, rate, pitch, quiet mode, and serialized speech. Runtime audio proof is absent.", "implementationPath": "design/apps/web/src/components/universal-settings/UniversalSettingsPanel.tsx", "documentationPath": "docs/standards/universal-settings.md", "requiredInteractions": [{ "id": "enable-narrator", "action": "click", "target": "narrator toggle", "expectedBefore": "narrator is off", "expectedAfter": "narrator is on with voice controls available", "postClickCaptureRequired": true }], "evidenceReceipts": [] },
        { "id": "scheduled-settings", "status": "partial", "statusReason": "The mounted universal editor and runtime cover local, validated HTTPS API, and Home Assistant schedules with safe fallback. The privileged desktop bridge is not mounted and runtime proof is absent.", "implementationPath": "design/apps/web/src/components/universal-settings/UniversalSettingsPanel.tsx", "documentationPath": "docs/standards/universal-settings.md", "requiredInteractions": [{ "id": "create-schedule", "action": "click", "target": "new schedule action", "expectedBefore": "schedule list is visible", "expectedAfter": "guided schedule editor is open", "postClickCaptureRequired": true }], "evidenceReceipts": [] },
        { "id": "dim-sum-surprise", "status": "partial", "statusReason": "The shell mounts the one-draw non-blocking surprise and suppresses it during first run, errors, updates, active work, and School mode. Packaged launch proof and public-catalog migration remain open.", "implementationPath": "design/apps/web/src/components/DimSumSurprise.tsx", "documentationPath": "docs/standards/dim-sum-surprise.md", "requiredInteractions": [{ "id": "observe-startup-surprise", "action": "click", "target": "launch application", "expectedBefore": "application is closed", "expectedAfter": "eligible deterministic startup fixture shows the non-blocking surprise", "postClickCaptureRequired": true }], "evidenceReceipts": [] },
        { "id": "regex-builders", "status": "partial", "statusReason": "The canonical hub and universal settings mount field-owned advanced builders. Complete every-menu and every-dropdown inventory plus built proof remain open.", "implementationPath": "design/apps/web/src/components/regex/RegexSearchField.tsx", "documentationPath": "docs/standards/regex-builder.md", "requiredInteractions": [{ "id": "open-anchored-regex-builder", "action": "click", "target": "regex builder affordance beside a search field", "expectedBefore": "plain-text search is active", "expectedAfter": "the field-owned advanced builder is open and anchored", "postClickCaptureRequired": true }], "evidenceReceipts": [] },
        { "id": "notification-centre", "status": "partial", "statusReason": "The canonical feature hub mounts the real searchable notification center with bulk review and destructive confirmation. Built interaction remains absent.", "implementationPath": "design/apps/web/src/components/notifications/NotificationCenter.tsx", "documentationPath": "docs/standards/notifications.md", "requiredInteractions": [{ "id": "open-notification-centre", "action": "click", "target": "notification history action", "expectedBefore": "main surface is visible", "expectedAfter": "reviewable notification list is open", "postClickCaptureRequired": true }], "evidenceReceipts": [] },